{
  "input_version": "1.0",
  "client_state": {
    "client_state_version": "1.0",
    "source": {
      "origin_skill": "client-intake",
      "origin_artifact": "CLIENT_PROFILE.md",
      "profile_path": "client-intake-data/clients/responsibility-without-income/CLIENT_PROFILE.md",
      "adapter": "risk-analysis/scripts/build-client-state.ps1",
      "adapter_version": "1.0",
      "intake_complete": true
    },
    "missing_from_upstream": [
      {
        "field": "annual_income",
        "profile": "financial_profile",
        "reason": "MISSING_FROM_UPSTREAM: client-intake 未提供"
      },
      {
        "field": "household_income",
        "profile": "financial_profile",
        "reason": "MISSING_FROM_UPSTREAM: client-intake 未提供"
      }
    ],
    "conflicts": [],
    "family_profile": {
      "age": {
        "value": 33,
        "status": "KNOWN",
        "source": {
          "layer": "client_state",
          "origin": {
            "skill": "client-intake",
            "field": "age"
          }
        },
        "confidence": 1.0
      },
      "marital_status": {
        "value": "已婚",
        "status": "KNOWN",
        "source": {
          "layer": "client_state",
          "origin": {
            "skill": "client-intake",
            "field": "marital_status"
          }
        },
        "confidence": 0.9
      },
      "children_count": {
        "value": 1,
        "status": "KNOWN",
        "source": {
          "layer": "client_state",
          "origin": {
            "skill": "client-intake",
            "field": "children_count"
          }
        },
        "confidence": 0.9
      },
      "children_info": {
        "value": "女儿 3 岁",
        "status": "KNOWN",
        "source": {
          "layer": "client_state",
          "origin": {
            "skill": "client-intake",
            "field": "children_info"
          }
        },
        "confidence": 0.9
      }
    },
    "financial_profile": {
      "annual_income": {
        "value": null,
        "status": "UNKNOWN",
        "source": {
          "layer": "client_state",
          "origin": {
            "skill": "client-intake",
            "field": "annual_income"
          }
        },
        "confidence": 0.0
      },
      "household_income": {
        "value": null,
        "status": "UNKNOWN",
        "source": {
          "layer": "client_state",
          "origin": {
            "skill": "client-intake",
            "field": "household_income"
          }
        },
        "confidence": 0.0
      }
    },
    "responsibility_profile": {
      "mortgage_balance": {
        "value": 1800000,
        "status": "KNOWN",
        "source": {
          "layer": "client_state",
          "origin": {
            "skill": "client-intake",
            "field": "mortgage_balance"
          }
        },
        "confidence": 0.9
      },
      "liabilities": {
        "value": "无",
        "status": "KNOWN",
        "source": {
          "layer": "client_state",
          "origin": {
            "skill": "client-intake",
            "field": "liabilities"
          }
        },
        "confidence": 0.9
      },
      "children_education": {
        "value": "无",
        "status": "KNOWN",
        "source": {
          "layer": "client_state",
          "origin": {
            "skill": "client-intake",
            "field": "children_education"
          }
        },
        "confidence": 0.9
      },
      "elderly_support": {
        "value": "无",
        "status": "KNOWN",
        "source": {
          "layer": "client_state",
          "origin": {
            "skill": "client-intake",
            "field": "elderly_support"
          }
        },
        "confidence": 0.9
      },
      "family_responsibility": {
        "value": "房贷 180 万",
        "status": "KNOWN",
        "source": {
          "layer": "client_state",
          "origin": {
            "skill": "client-intake",
            "field": "family_responsibility"
          }
        },
        "confidence": 0.9
      }
    },
    "existing_protection": {
      "social_insurance_status": {
        "value": "城镇职工医保",
        "status": "KNOWN",
        "source": {
          "layer": "client_state",
          "origin": {
            "skill": "client-intake",
            "field": "social_insurance_status"
          }
        },
        "confidence": 0.9
      },
      "existing_life_coverage": {
        "value": 0,
        "status": "KNOWN",
        "source": {
          "layer": "client_state",
          "origin": {
            "skill": "client-intake",
            "field": "existing_life_coverage"
          }
        },
        "confidence": 0.9
      },
      "existing_medical_coverage": {
        "value": 0,
        "status": "KNOWN",
        "source": {
          "layer": "client_state",
          "origin": {
            "skill": "client-intake",
            "field": "existing_medical_coverage"
          }
        },
        "confidence": 0.9
      }
    },
    "health_profile": {},
    "employment_profile": {
      "occupation": {
        "value": "行政专员",
        "status": "KNOWN",
        "source": {
          "layer": "client_state",
          "origin": {
            "skill": "client-intake",
            "field": "occupation"
          }
        },
        "confidence": 0.9
      },
      "employment_type": {
        "value": "全职",
        "status": "KNOWN",
        "source": {
          "layer": "client_state",
          "origin": {
            "skill": "client-intake",
            "field": "employment_type"
          }
        },
        "confidence": 0.9
      }
    }
  },
  "requirements": [
    {
      "requirement_id": "REQ-004",
      "requirement_type": "critical_illness",
      "summary": "关注重疾收入中断",
      "priority": "P2_MEDIUM",
      "boundary": "requirement_only"
    }
  ],
  "upstream": {
    "client_intake": {
      "provided": true,
      "intake_complete": true,
      "profile_path": "client-intake-data/clients/responsibility-without-income/CLIENT_PROFILE.md"
    },
    "requirement_analysis": {
      "provided": true,
      "analysis_status": "PRELIMINARY",
      "analysis_scope": [
        "life",
        "critical_illness",
        "accident"
      ],
      "output_path": "requirement_analysis/tmp/responsibility-without-income.json",
      "unknowns": [],
      "assumptions": []
    }
  },
  "analysis_scope": [
    "R1",
    "R2",
    "R3",
    "R4",
    "R5"
  ],
  "provenance_index": [
    {
      "client_state_field": "family_profile.age",
      "origin_skill": "client-intake",
      "origin_field": "age",
      "status": "KNOWN"
    },
    {
      "client_state_field": "family_profile.marital_status",
      "origin_skill": "client-intake",
      "origin_field": "marital_status",
      "status": "KNOWN"
    },
    {
      "client_state_field": "family_profile.children_count",
      "origin_skill": "client-intake",
      "origin_field": "children_count",
      "status": "KNOWN"
    },
    {
      "client_state_field": "family_profile.children_info",
      "origin_skill": "client-intake",
      "origin_field": "children_info",
      "status": "KNOWN"
    },
    {
      "client_state_field": "financial_profile.annual_income",
      "origin_skill": "client-intake",
      "origin_field": "annual_income",
      "status": "UNKNOWN"
    },
    {
      "client_state_field": "financial_profile.household_income",
      "origin_skill": "client-intake",
      "origin_field": "household_income",
      "status": "UNKNOWN"
    },
    {
      "client_state_field": "responsibility_profile.mortgage_balance",
      "origin_skill": "client-intake",
      "origin_field": "mortgage_balance",
      "status": "KNOWN"
    },
    {
      "client_state_field": "responsibility_profile.liabilities",
      "origin_skill": "client-intake",
      "origin_field": "liabilities",
      "status": "KNOWN"
    },
    {
      "client_state_field": "responsibility_profile.children_education",
      "origin_skill": "client-intake",
      "origin_field": "children_education",
      "status": "KNOWN"
    },
    {
      "client_state_field": "responsibility_profile.elderly_support",
      "origin_skill": "client-intake",
      "origin_field": "elderly_support",
      "status": "KNOWN"
    },
    {
      "client_state_field": "responsibility_profile.family_responsibility",
      "origin_skill": "client-intake",
      "origin_field": "family_responsibility",
      "status": "KNOWN"
    },
    {
      "client_state_field": "existing_protection.social_insurance_status",
      "origin_skill": "client-intake",
      "origin_field": "social_insurance_status",
      "status": "KNOWN"
    },
    {
      "client_state_field": "existing_protection.existing_life_coverage",
      "origin_skill": "client-intake",
      "origin_field": "existing_life_coverage",
      "status": "KNOWN"
    },
    {
      "client_state_field": "existing_protection.existing_medical_coverage",
      "origin_skill": "client-intake",
      "origin_field": "existing_medical_coverage",
      "status": "KNOWN"
    },
    {
      "client_state_field": "employment_profile.occupation",
      "origin_skill": "client-intake",
      "origin_field": "occupation",
      "status": "KNOWN"
    },
    {
      "client_state_field": "employment_profile.employment_type",
      "origin_skill": "client-intake",
      "origin_field": "employment_type",
      "status": "KNOWN"
    }
  ]
}